№,Тег,Термин,Описание → осн. текст,SEO Тайтл,SEO Дескрипшн,,Первоначальные варианты определений
144,Платформа,Платформа,"Многосторонняя бизнес-модель, которая создаёт ценность через организацию взаимодействия между двумя или более группами участников (производителями, потребителями, партнёрами), обеспечивает инфраструктуру для обмена товарами, услугами или информацией, использует сетевые эффекты для роста и извлекает данные для улучшения опыта всех сторон экосистемы.",Что такое Платформа: определение термина | Глоссарий Rocketmind,"Платформа — бизнес-модель, создающая ценность через взаимодействие между участниками. Полное определение, типы платформ и примеры — в глоссарии Rocketmind.",,"несколько определений одного термина. Многосторонняя бизнес-модель, объединяющая производителей, потребителей и партнёров на основе сетевых эффектов и анализа данных, обеспечивающая взаимодействие между участниками и сервисами экосистемы."
145,"Платформа, Бизнес-модели",Платформенная бизнес-модель,"Модель создания ценности через организацию взаимодействия между участниками платформы с использованием сетевых эффектов и эффекта масштаба, основанная на создании цифровой платформы, объединяющей производителей, потребителей и других участников для обмена ценностями.",Что такое Платформенная бизнес-модель: определение термина | Глоссарий Rocketmind,"Платформенная бизнес-модель — логика бизнеса, основанная на соединении участников рынка. Полное определение, отличия от линейной модели и примеры — в глоссарии Rocketmind.",,Платформенная модель + несколько определений
146,"Платформа, Бизнес-модели",Платформенная пирамида ценности,"Модель, которая описывает три уровня создания ценности платформой — базовый уровень инфраструктуры (технологическая основа для взаимодействия), средний уровень инсайтов (анализ данных и персонализация) и верхний уровень вовлечения (прямое взаимодействие участников и обмен ценностью), где каждый следующий уровень усиливает предыдущий и увеличивает общую ценность экосистемы.",Что такое Платформенная пирамида ценности: определение термина | Глоссарий Rocketmind,"Платформенная пирамида ценности — модель уровней ценности, создаваемой платформой. Полное определение, уровни и примеры — в глоссарии Rocketmind.",,"Модель создания ценности на уровнях вовлечения, инсайтов и инфраструктуры."
147,"Платформа, Бизнес-модели",Платформенная экономика,"Экономический уклад, в котором цифровые платформы стали доминирующей моделью создания стоимости через организацию взаимодействия между производителями и потребителями, где ценность создаётся не владением активами, а координацией обмена между участниками, использованием сетевых эффектов и монетизацией данных.",Что такое Платформенная экономика: определение термина | Глоссарий Rocketmind,"Платформенная экономика — новый уклад, где платформы стали доминирующей моделью создания стоимости. Полное определение и примеры — в глоссарии Rocketmind.",,Бизнес-модель на основе цифровых площадок для объединения производителей и потребителей.
148,"Платформа, Бизнес-модели",Платформенное мышление,"Стратегический подход к проектированию бизнеса, при котором фокус смещается с создания и продажи продуктов на организацию взаимодействия между несколькими сторонами участников, использование сетевых эффектов для масштабируемого роста и создание экосистемы, где ценность возникает из качества и объёма обменов между пользователями.",Что такое Платформенное мышление: определение термина | Глоссарий Rocketmind,"Платформенное мышление — взгляд на бизнес как на систему взаимодействий, а не продуктов. Полное определение, принципы и применение — в глоссарии Rocketmind.",,"Подход к созданию бизнес-моделей, основанный на взаимодействии нескольких сторон на одной платформе для масштабируемого роста."
149,"Платформа, Бизнес-модели",Платформенный бизнес,"Бизнес, который создаёт ценность через соединение и ускорение обмена между разными группами пользователей (производителями и потребителями), предоставляет инфраструктуру для транзакций, использует сетевые эффекты для роста и зарабатывает на координации взаимодействий, а не на владении активами или прямом производстве товаров и услуг.",Что такое Платформенный бизнес: определение термина | Глоссарий Rocketmind,"Платформенный бизнес — компания, создающая ценность через соединение участников рынка. Полное определение, примеры и отличия от традиционного — в глоссарии Rocketmind.",,"Бизнес-модель, ускоряющая обмен ценностью между группами пользователей."
150,"Бизнес-модели, Бизнес-дизайн",Повторяемость,"Способность бизнес-процесса, модели или действия воспроизводиться многократно с предсказуемым и стабильным результатом при минимальных вариациях качества, что позволяет компании стандартизировать операции, масштабировать деятельность, обучать новых сотрудников и поддерживать устойчивый рост без потери эффективности.",Что такое Повторяемость: определение термина | Глоссарий Rocketmind,Повторяемость — способность бизнес-процесса воспроизводиться с предсказуемым результатом. Полное определение и роль в масштабировании — в глоссарии Rocketmind.,,Способность бизнеса поддерживать рост через повторяющиеся действия.
151,Цифровизация,Подключенный продукт,"Физическое устройство с встроенными датчиками, интернет-подключением и программным обеспечением, которое передаёт данные, управляется через мобильное приложение или веб-интерфейс и обладает расширенной функциональностью через удалённые обновления, автоматизацию и интеграцию с другими сервисами (примеры — умные часы, термостаты, автомобили с IoT).",Что такое Подключенный продукт: определение термина | Глоссарий Rocketmind,"Подключенный продукт — физический товар с цифровым компонентом, передающий данные. Полное определение, примеры IoT и связанные термины — в глоссарии Rocketmind.",,"Устройство с интернет-подключением и расширенной функциональностью, управляемое приложением."
152,Монетизация,Подписка,Модель на основе регулярных платежей за доступ к продукту или услуге.,Что такое Подписка: определение термина | Глоссарий Rocketmind,"Подписка — модель монетизации через регулярные платежи за доступ к продукту. Полное определение, виды и примеры — в глоссарии Rocketmind.",,Модель на основе регулярных платежей за доступ к продукту или услуге.
153,Бизнес-дизайн,Позиционирование на рынке,"Маркетинговый процесс создания и закрепления уникального образа компании или бренда в сознании целевой аудитории относительно конкурентов, который определяет, как клиенты воспринимают компанию, какие ассоциации и ценности с ней связывают, и на какое место в конкурентной среде она претендует.",Что такое Позиционирование на рынке: определение термина | Глоссарий Rocketmind,"Позиционирование на рынке — место, которое бренд занимает в сознании целевой аудитории. Полное определение, инструменты и примеры — в глоссарии Rocketmind.",,Маркетинговый процесс определения конкурентного положения.
154,Бизнес-дизайн,Позиционирование продукта,"Стратегия формирования уникального и привлекательного образа продукта в восприятии целевых покупателей через выделение отличительных характеристик, выгод и ценности, которые отвечают на вопрос «Почему клиент должен выбрать именно этот продукт?» и дифференцируют его от конкурентов на рынке.",Что такое Позиционирование продукта: определение термина | Глоссарий Rocketmind,Позиционирование продукта — формирование уникального образа продукта в восприятии покупателей. Полное определение и примеры — в глоссарии Rocketmind.,,Определение уникального места на рынке.
155,"Бизнес-дизайн, Эксперименты",Поиск и подтверждение бизнес-модели,"Критический этап развития стартапа, на котором команда через серию экспериментов и итераций разрабатывает гипотезы о ключевых элементах бизнес-модели (проблема, решение, сегмент, каналы, монетизация) и проверяет их валидность на реальном рынке с реальными клиентами для нахождения устойчивой и масштабируемой модели до перехода к росту.",Что такое Поиск и подтверждение бизнес-модели: определение термина | Глоссарий Rocketmind,"Поиск и подтверждение бизнес-модели — этап стартапа, на котором гипотезы проверяются реальным рынком. Полное определение — в глоссарии Rocketmind.",,Анализ для разработки и проверки гипотез.
156,Бизнес-модели,Портфель бизнес-моделей,"Набор различных бизнес-моделей, которые компания использует одновременно для адаптации к рынку, создания ценности и достижения стратегических целей.",Что такое Портфель бизнес-моделей: определение термина | Глоссарий Rocketmind,"Портфель бизнес-моделей — совокупность разных моделей внутри одной компании. Полное определение, управление и примеры — в глоссарии Rocketmind.",,несколько определений одного термина
157,"Экосистема, Бизнес-дизайн",Портфельный подход,"Стратегия управления несколькими бизнес-направлениями, продуктами или экосистемами компании как единой сбалансированной системой через координацию развития, оптимальное распределение ресурсов между направлениями, управление рисками и синхронизацию целей для достижения максимальной совокупной ценности портфеля.",Что такое Портфельный подход: определение термина | Глоссарий Rocketmind,"Портфельный подход — управление несколькими бизнес-направлениями как единой системой. Полное определение, принципы и примеры — в глоссарии Rocketmind.",,Управление экосистемами через координацию и распределение ресурсов.
158,"Бизнес-дизайн, Бизнес-модели",Поток создания ценности,"Последовательность всех операций, процессов и действий, через которые ресурсы и исходные материалы преобразуются в готовый продукт или услугу и доставляются клиенту — от идеи и разработки до производства, дистрибуции и послепродажного обслуживания — с целью создания ценности для потребителя.",Что такое Поток создания ценности: определение термина | Глоссарий Rocketmind,"Поток создания ценности — последовательность действий, превращающих ресурсы в ценность для клиента. Полное определение и примеры — в глоссарии Rocketmind.",,Последовательность операций по созданию и доставке ценности.
159,"Монетизация, Бизнес-модели, Платформа",Потоки дохода (Revenue Streams),Различные источники финансовых поступлений компании и платформы от клиентских сегментов и участников.,Что такое Потоки дохода (Revenue Streams): определение термина | Глоссарий Rocketmind,"Revenue Streams — блок бизнес-модели, описывающий все источники дохода компании. Полное определение, типы и примеры — в глоссарии Rocketmind.",,Потоки доходов
160,"Монетизация, Бизнес-модели, Платформа",Потоки расходов,"Структура и категории всех затрат, которые компания или платформа несёт для создания, доставки и поддержки ценностного предложения — включает постоянные расходы (аренда, зарплаты, инфраструктура), переменные издержки (производство, маркетинг, комиссии) и инвестиции в развитие продукта и масштабирование.",Что такое Потоки расходов: определение термина | Глоссарий Rocketmind,"Потоки расходов — все затраты, которые несёт бизнес для создания и доставки ценности. Полное определение и примеры — в глоссарии Rocketmind.",,Структура затрат платформы.
161,"Монетизация, Бизнес-модели, Платформа",Потоки транзакций,"Движение ресурсов, товаров, услуг, информации или денежных средств между различными участниками платформы (производителями, потребителями, партнёрами), которое представляет собой обмен ценностью и формирует основу для монетизации и создания сетевых эффектов в экосистеме.",Что такое Потоки транзакций: определение термина | Глоссарий Rocketmind,"Потоки транзакций — обмены ценностью между участниками платформы. Полное определение, схемы и примеры — в глоссарии Rocketmind.",,Движение ресурсов между участниками платформы.
162,"Платформа, Экосистема, Бизнес-дизайн",Потребитель ценности,"Участник платформы или экосистемы, который использует, приобретает или получает выгоду от товаров и услуг, созданных производителями ценности.",Что такое Потребитель ценности: определение термина | Глоссарий Rocketmind,"Потребитель ценности — участник экосистемы, получающий, а не создающий ценность на платформе. Полное определение и примеры — в глоссарии Rocketmind.",,несколько определений одного термина
163,Бизнес-дизайн,Потребности клиентов,"Желаемые результаты, проблемы, задачи и неудовлетворённые запросы целевой аудитории, которые клиенты стремятся решить или достичь через продукты и услуги — могут быть функциональными (выполнить задачу), эмоциональными (чувствовать себя определённым образом) или социальными (соответствовать ожиданиям окружения), и являются основой для создания релевантного ценностного предложения.",Что такое Потребности клиентов: определение термина | Глоссарий Rocketmind,"Потребности клиентов — желаемые результаты и проблемы, которые клиент хочет решить. Полное определение, методы выявления и примеры — в глоссарии Rocketmind.",,Неудовлетворенные запросы и растущий спрос.
164,Роли и команда,Предприниматель,"Человек, который инициирует, создаёт и управляет новым бизнесом, принимает на себя финансовые риски и неопределённость ради получения прибыли, создания ценности и реализации бизнес-идеи, объединяет ресурсы, формирует команду и преобразует возможности рынка в устойчивое предприятие.",Что такое Предприниматель: определение термина | Глоссарий Rocketmind,"Предприниматель — человек, создающий ценность через организацию нового бизнеса. Полное определение, роли и связанные термины — в глоссарии Rocketmind.",,"Лицо, инициирующее и управляющее бизнесом с финансовыми рисками ради прибыли."
165,Платформа,Привлечение пользователей платформы,"Комплекс стратегий и тактик для роста аудитории платформы через привлечение потребителей и производителей ценности на начальном этапе и в процессе масштабирования — включает маркетинговые каналы, вирусные механики, стимулы для ранних пользователей, партнёрства и создание начальной ликвидности для запуска сетевых эффектов.",Что такое Привлечение пользователей платформы: определение термина | Глоссарий Rocketmind,"Привлечение пользователей платформы — процесс роста аудитории платформы через маркетинг и вирусность. Полное определение, механики и примеры — в глоссарии Rocketmind.",,Стратегия привлечения потребителей и производителей на платформу.
